{
    "$schema": "https://raw.githubusercontent.com/IntersectMBO/cardano-config/v2/schemas/ProtocolConfig.schema.json",
    "RequiresNetworkMagic": "RequiresMagic",
    "ByronGenesisFile": "byron-genesis.json",
    "ByronGenesisHash": "83de1d7302569ad56cf9139a41e2e11346d4cb4a31c00142557b6ab3fa550761",
    "ShelleyGenesisFile": "shelley-genesis.json",
    "ShelleyGenesisHash": "363498d1024f84bb39d3fa9593ce391483cb40d479b87233f868d6e57c3a400d",
    "AlonzoGenesisFile": "alonzo-genesis.json",
    "AlonzoGenesisHash": "7e94a15f55d1e82d10f09203fa1d40f8eede58fd8066542cf6566008068ed874",
    "ConwayGenesisFile": "conway-genesis.json",
    "ConwayGenesisHash": "9cc5084f02e27210eacba47af0872e3dba8946ad9460b6072d793e1d2f3987ef",
    "CheckpointsFile": "checkpoints.json",
    "CheckpointsFileHash": "bb5056ff1ced9d68dd99720695789664f6bf6f0cb02a4010df09b813e225ac51"
}
