{
    "RequiresNetworkMagic": "RequiresMagic",
    "ByronGenesisFile": "byron-genesis.json",
    "ByronGenesisHash": "d4b8de7a11d929a323373cbab6c1a9bdc931beffff11db111cf9d57356ee1937",
    "ShelleyGenesisFile": "shelley-genesis.json",
    "ShelleyGenesisHash": "162d29c4e1cf6b8a84f2d692e67a3ac6bc7851bc3e6e4afe64d15778bed8bd86",
    "AlonzoGenesisFile": "alonzo-genesis.json",
    "AlonzoGenesisHash": "7e94a15f55d1e82d10f09203fa1d40f8eede58fd8066542cf6566008068ed874",
    "ConwayGenesisFile": "conway-genesis.json",
    "ConwayGenesisHash": "0eb6adaec3fcb1fe286c1b4ae0da2a117eafc3add51e17577d36dd39eddfc3db"
}
