{
    "ByronGenesisFile": "mainnet-byron-genesis.json",
    "ByronGenesisHash": "5f20df933584822601f9e3f8c024eb5eb252fe8cefb24d1317dc3d432e940ebb",
    "RequiresNetworkMagic": "RequiresNoMagic",
    "ShelleyGenesisFile": "mainnet-shelley-genesis.json",
    "ShelleyGenesisHash": "1a3be38bcbb7911969283716ad7aa550250226b76a61fc51cc9a9a35d9276d81",
    "AlonzoGenesisFile": "mainnet-alonzo-genesis.json",
    "AlonzoGenesisHash": "7e94a15f55d1e82d10f09203fa1d40f8eede58fd8066542cf6566008068ed874",
    "ConwayGenesisFile": "mainnet-conway-genesis.json",
    "ConwayGenesisHash": "15a199f895e461ec0ffc6dd4e4028af28a492ab4e806d39cb674c88f7643ef62",
    "CheckpointsFile": "mainnet-checkpoints.json",
    "CheckpointsFileHash": "3e6dee5bae7acc6d870187e72674b37c929be8c66e62a552cf6a876b1af31ade"
}
